VIDEO: Avatar 2 si objednal světelnou show nad Niagarskými vodopády;Nový trailer k projektu Jamese Camerona Avatar: The Way of Water zažil mimořádnou premiéru. K jeho zveřejnění se nad Niagarskými vodopády nachystala ohromující světelná show s ukázkami z filmu.
VIDEO: Vždycky vyhrajeme. Olympic slaví narozeniny a naděluje sběratelům;Kapela Olympic slaví v příštím roce 60. výročí a při té příležitosti fanouškům nachystala několik překvapení. Kromě koncertního turné je to třeba limitovaný box pěti LP desek nebo sběratelskou eurobankovku.
RECENZE: Vrchol roku. Študáci a kantoři zažívají vtipnou Zkoušku umění;Do kin vstupuje zatím nejlepší český film roku. Nejenže s nečekaně zábavným dokumentem Zkouška umění vyhráli režiséři Adéla Komrzý a Tomáš Bojar na karlovarském festivalu soutěž Proxima, ale postarali se jím rovněž o předmět neméně veselých šarvátek.
Nejvíc se modlím za své nepřátele, líčí Jiří Strach, tvůrce Anděla Páně;Den po svátku Všech svatých, 3. listopadu 2005, se změnily dějiny vánočních pohádek. Tehdy do kin vstoupil Anděl Páně. Počátkem adventu před šesti lety přibyl Anděl Páně 2 a oba díly se staly milovanou součástí svátků. „Třetí příběh je zhruba napsaný, ale pokud nebude, nic se nestane,“ říká v rozhovoru pro iDNES.cz režisér Jiří Strach.
Rozloučení s Michalem Ambrožem bude ve Strašnicích, uvedl jeho spoluhráč;Poslední rozloučení s rockovým zpěvákem, kytaristou, skladatelem a textařem Michalem Ambrožem se uskuteční 9. listopadu v pražském krematoriu Strašnice. Hudebník známý jako frontman skupin Jasná páka, Hudba Praha a Divoký srdce po delší nemoci zemřel 31. října ve věku 68 let. ČTK o tom informoval jeho spoluhráč a kapelník Hudby Praha, kytarista Radovan Jelínek.
V síti: Za školou už je k vidění i doma. Rodičům tvůrci nabízí i příručku;Nejdříve jen ve škole, teď už i doma. Speciální upravenou verzi dokumentu V síti: Za školou pro diváky od 12 let si mohou nově rodiče společně s dětmi pustit na platformě KVIFF.TV. Tvůrci diskutovaného dokumentu o sexuálních predátorech nabízí na internetu ke stažení i metodologickou příručku, která radí jak o tématu s ratolestmi hovořit.
VIDEO: Skandální Rej není jen o sexu, nabídne i vizi Hitlerova architekta;Deset hovorů o milostném aktu, před ním, či po něm. Stavovské divadlo už ve čtvrtek uvede inscenaci kdysi skandální hry Arthura Schnitzlera Rej. Režie se chopil uznávaný francouzský divadelník Arthur Nauzyciel, který děj přesunul do Hitlerovy vysněné Germanie.
Vánoce na ČT obstará Krakonošovo tajemství, nový rok zahájí Zátopek;Pohádkové Vánoce v České televizi zahrnou původní novinku Krakonošovo tajemství a distribuční film Tajemství staré bambitky 2. Koncem roku se příběhem Saturnin rozloučí program ČT3, naopak nový rok rozběhne v televizní premiéře Zátopek.
Zemřela Julie Powellová, podle její knihy vznikl film o vaření Julie a Julia;Spisovatelka a autorka blogu o vaření Julie Powellová zemřela, bylo jí 49 let. Její autobiografická kniha se stala předlohou pro film Julie a Julia z roku 2008, ve kterém hrála Meryl Streepová.
RECENZE: Půlnoční bdění s Taylor Swift není nijak obohacující;Vypadá to, že celý hudbymilovný svět čekal na novou desku zpěvačky Taylor Swift. Nahrávka Midnights se v den vydání stala nejstreamovanějším albem za jediný den na Spotify, Apple Music i Amazon Music.
KOMENTÁŘ: Komediální série roku. Zastíní prezidentští baviči Prezidentku?;Doposud žádný seriálový hrdina, snad ani blahé paměti primář Sova z Nemocnice na kraji města, neměl zaručeno, že dostane během čtrnácti dnů k dispozici nejméně pět hodin osobního vysílacího času. To se brzy změní.
Dvojka Princezny zakleté v čase má výpravu jako fantasy film, říká režisér Kubík;Na kvalitní a zároveň moderní českou pohádku už pořádně dlouho nenarazíte. Snímek Princezna zakletá v čase režiséra Petra Kubíka ale nabízí sebevědomý originální příběh na pomezí dvou žánrů – klasické pohádky a fantasy. Pohádka zaznamenala divácký úspěch a nyní se proto připravuje pokračování.
Vzpomenout si na čas mládí i smysl bytí, láká autor románu Jen záblesk;Chcete znovu prožít ztracený čas šťastného mládí? Podle fotografa, malíře a spisovatele Jana Podešvy tak můžete učinit s jeho novou knihou Jen záblesk. Román věnoval všem, „kteří ještě nezapomněli číst“. Knihu lze objednat na jeho osobních stránkách.
Raper Takeoff z kapely Migos zemřel, zastřelili ho při hře v kostky;Americký raper Takeoff z kapely Migos zemřel, zastřelil ho zatím neznámý pachatel v bowlingovém centru v Houstonu při hře kostek. Na místě byl osmadvacetiletý raper s ostatními členy své kapely na soukromé párty.
Jak herec Havel a diktátor Husák zasáhli do života Marty Kubišové;O Martě Kubišové už bylo napsáno mnohé, ale najdou se i méně známé střípky jejího života, bez nichž by mozaika nebyla kompletní. Řeč je například o nikdy nevydané coververzi Beatles nebo nenatočených epizodách Písně pro Rudolfa III.
Nevzpomínané výročí. V roce 1956 svobodný svět Maďarům nepomohl;Trochu se opravím, výročí maďarského povstání z roku 1956 se vzpomíná hodně, když je kulaté, a velmi sporadicky v létech ostatních. Na pořádné vzpomínání si tedy počkáme čtyři roky.
Oteplování hrozí víc než kdy jindy. V Egyptě začal summit zabývající se změnami klimatu;V egyptském letovisku Šarm aš-Šajch v neděli začala dvoutýdenní klimatická konference OSN (COP27). Už nyní je přitom takřka jisté, že se nepodaří v nejbližších letech zastavit nárůst globální teploty na kýžené hranici 1,5 stupně Celsia v porovnání s předprůmyslovou érou. Dle expertů svět nyní směřuje k oteplení až o zhruba 2,5 °C do konce 21. století.
Křetínského EPC je výjimka, další odchody firem nebudou, věří Fiala i Rusnok;Premiér Petr Fiala neočekává další odchody firem z tuzemska kvůli zavedení daně z neočekávaných zisků, kterou v pátek schválila Sněmovna a která dopadne na energetické firmy a banky. V případě firmy EP Commodities z Energetického a průmyslového holdingu (EPH) miliardáře Daniela Křetínského šlo podle Fialy o specifický problém.
Připlácet si za nadstandardní péči? Asociální, vzkázaly ministru Válkovi odbory;Ministr zdravotnictví Vlastimil Válek na sobotní stranické konferenci TOP 09 prohlásil, že chce vrátit do hry nadstandardy ve zdravotnictví. Současně připustil, že zavedení nadstandardů by vedlo k rozdělení kvality péče do dvou skupin. Na jeho slova v neděli reagovaly zdravotnické odbory, které považují za demagogické vysvětlení, že „to přinese zkvalitnění pro všechny“.
Tanzanské dopravní letadlo spadlo do Viktoriina jezera, 19 lidí nehodu nepřežilo;V Tanzanii v neděli havarovalo dopravní letadlo místních aerolinií, při pokusu o přistání skončilo ve Viktoriině jezeře. Na palubě bylo 43 lidí, uvedla agentura AFP s odvoláním na policii. Počet mrtvých se z původních tři během záchranných akcí vyšplhal na devatenáct.
Ukrajinci zasáhli výpust Kachovské přehrady, tvrdí Rusové. Cherson je bez vody;V neděli ukrajinské síly provedly úder šesti raketami HIMARS na  Kachovskou vodní elektrárnu, tvrdí ruská média. Pět z nich bylo sestřeleno, jedna ale zasáhla výpust Kachovské přehrady. Cherson a další obce jsou nyní bez dodávek vody i elektřiny.
Policisté v Praze bourali do železniční signalizace, provoz na trati stál;Při výjezdu k události havarovalo v neděli odpoledne v pražských Holešovicích policejní auto. Nejprve zavadilo o středový obrubník, načež nabouralo do sloupu světelné železniční signalizace. Do zlomené závory posléze narazil projíždějící vlak.
Kyjev nevylučuje scénář úplného blackoutu, občany připravuje na odchod;Vedení Kyjeva připravuje scénář evakuace všech obyvatel města pro případ, že by v něm nastal úplný výpadek proudu. Starosta Kyjeva Vitalij Kličko varoval již v sobotu občany před tím, že se město může ocitnout bez světla, vody i vytápění.
Slováci chystají blokádu dálnice D2 z Česka. Kvůli zdlouhavým kontrolám migrantů;Hraniční přechod Lanžhot - Kúty na dálnici D2 chtějí v noci z neděle na pondělí zcela zablokovat slovenští autodopravci. Protestují proti neúměrným kontrolám, které zavedla česká strana kvůli nelegální migraci. V kolonách do ČR stávají kamiony i osm hodin. Na české straně chce policie ve stejnou dobu zdvojnásobit kapacitu odbavování nákladních vozidel, aby kontroly urychlila.
Americké, nebo české? Armáda chce nakoupit nové pancéřovky, jenže stojí před dilematem;Ministerstvo obrany připravuje nákup reaktivních protitankových granátů, známých také jako pancéřovky. Důležitost těchto zbraní i na moderním válčišti ukazuje konflikt na Ukrajině. Podle informací serveru Lidovky.cz má být favoritem norská společnost NAMMO s americkou pancéřovkou M72. Přitom zbraň prakticky totožných parametrů s názvem RPG 75 produkuje i český výrobce Zeveta Bojkovice. Ten jich také již tisíce dodal bojujícím Ukrajincům.
Policie zadržela podezřelého z požáru v ruském klubu, bojoval na Ukrajině;Ruská policie již zadržela údajného viníka požáru v baru Polygon v ruské Kostromě. Podle ruskojazyčných webů se jedná o třiadvacetiletého Stanislava Jonkina, vojáka, který sloužil v Luhanské oblasti na Ukrajině. Muž se k činu přiznal, rodinní příslušníci však jeho vinu popírají.
PETRÁČEK: Je krácení penzí spravedlnost? Nebo spíš akt odplaty na stařících;Heslo vyrovnat se s minulostí je oblíbené, leč zavádějící. Minulost můžeme poznávat – v našem případě zejména tu komunistickou, neboť stále žije dost lidí jí poznamenaných. Můžeme ji interpretovat různými způsoby, o které se vedou spory. Ale jak se s ní můžeme vyrovnat?
Ekonomové: Deficit státního rozpočtu bude příští rok vyšší, než míní vláda;Schodek státního rozpočtu bude v příštím roce vyšší, než v současnosti odhaduje vláda. Shodli se na tom dnes ekonomové v pořadu České televize Otázky Václava Moravce. Podle nich deficit výrazně překročí 300 miliard korun, podle návrhu vlády by měl být 295 miliard korun. Podle ekonomů bude v budoucnu nutné zvýšit daně.
Oteplování zrychluje, za století stoupnou oceány až o metr, burcují meteorologové;Oteplování planety i stoupání hladin oceánů zrychluje, posledních osm let bylo nejteplejších v historii záznamů a odtávání ledovců už nic nezastaví. Ve své zprávě, zveřejněné u příležitosti zahájení klimatické konference OSN (COP27) v Egyptě, to dnes uvedla Světová meteorologická organizace.
Čtvero odmítnutí katastrofismu. Nenechme si negativně ovlivňovat životy;/ÚHEL POHLEDU/ Ještě před několika lety jsme se ujišťovali, že žijeme v nejlepším období lidských dějin, že jsme se nikdy neměli tak dobře z pohledu kvality života a demokracie. Píše se rok 2022 a všechno je vzhůru nohama. Naše vystrašená civilizace, a s ní Česká republika, se naopak ujišťuje, že žijeme v kruhu neustálých krizí a pohrom. Kdo neřekne, že civilizace je na sestupu, je nudný a nezajímavý.
„Když to všechno začalo, velitelé okamžitě utekli.“ V Luhanské oblasti zahynuly stovky ruských branců;V noci na středu překvapily ukrajinské síly poblíž Makijivky ruské brance z Voroněžské oblasti. Ti se ocitli pod palbou sami bez jakéhokoliv velení. Tamní média se odvolávají na jednoho z přeživších, vojáka Alexeje Agafonova, podle nějž by počet obětí mohl přesáhnout 500.
Místo školky rodič odvedle. Vláda plánuje uzákonit sousedské hlídání;Míst v mateřských školách je málo. To v Česku řeší každý rok stovky rodičů. Situaci by mohla zlepšit novela, která by uzákonila takzvané sousedské hlídání. Podle odborníků jde o dobrou provizorní možnost, vhodná je ale jen pro malé děti, pravidla navíc musí stát vhodně nastavit.
Rus ustupuje, jen když dostane na budku, reagoval Lipavský na slova o příměří;Je čas mluvit o příměří, řekl v nedělní Partii Terezie Tománkové televize CNN Prima NEWS místopředseda ANO Radek Vondráček. Podle ministra zahraničí Jana Lipavského (Piráti) ale Rusové ustupují až tehdy, když „dostanou na budku“. V tutéž chvíli ale podle něj ruská propaganda stále mluví o tom, že půjdou do Pobaltí, na Polsko nebo Moldavsko. Za své činy by Rusové měli podle Lipavského nést odpovědnost.
V Rusku se utváří agresivní společnost, na lidi působí silná propaganda, líčí ruský sociolog nálady v zemi;Propaganda pomáhá Rusům potlačit vlastní svědomí. Je to jejich záchranný kruh. Avšak Rusové si válku proti Ukrajině nepřejí, roste počet lidí, kteří dávají přednost příměří, zahájení mírových jednání a konci bojů. Ale setrvačnost oportunismu převládá, říká rozhovoru pro Lidovky.cz známý ruský sociolog Lev Gudkov z nezávislé ruské sociologické agentury Levada-Center. A popisuje, jak ve válečných podmínkách funguje ruská společnost.
Rusko v noci ostřelovalo obytné oblasti, z neúspěchů viní armádní velení;Ruské síly v noci na neděli ostřelovaly rezidenční čtvrť v Záporoží na jihu Ukrajiny. Útok si podle tajemníka záporožské radnice Anatolije Kurtěva vyžádal jeden lidský život. Britské ministerstvo obrany mezitím oznámilo, že ruské vedení se pokouší připsat neúspěch svých vojenských sil ruským velitelům.
Covid je už měsíc na ústupu. V těžkém stavu v nemocnicích je 25 lidí;V Česku testy v sobotu potvrdily 144 nově nakažených koronavirem, o jednotky případů méně než před týdnem. Počet hospitalizovaných s potvrzenou nákazou klesl na 543, nemocniční péči tak vyžaduje nejméně nakažených od poloviny července, před týdnem jich bylo o 200 víc.
O zvýšení mzdy chce žádat 32 procent zaměstnanců, ukázal průzkum;Žádat zvýšení mzdy chce v následujících měsících podle průzkumu společnosti Up Česká republika 32 procent zaměstnanců. Plánují si říci také o navýšení benefitů nebo podpory stravování. Jen pět procent lidí ale očekává, že jim zaměstnavatel vyjde vstříc v plném rozsahu.
V Peru demonstrovaly tisíce lidí, požadovaly odstoupení prezidenta;Po celém Peru vyšly do ulic tisíce lidí a požadovaly odstoupení levicového prezidenta Pedra Castilla, jehož vláda je vyšetřována kvůli korupci, uvedla agentura Reuters. Castillo označil odpůrce své vlády za reakcionáře a nepřátele lidu.
Vláda USA soukromě žádá Ukrajinu, aby projevila ochotu jednat s Ruskem;Vláda amerického prezidenta Joea Bidena soukromě vybízí představitele Ukrajiny, aby dali najevo ochotu jednat s Ruskem a upustili od veřejného odmítání mírových rozhovorů, pokud bude ruský prezident Vladimir Putin u moci. Uvedl to list The Washigton Post s odvoláním na nejmenované osoby obeznámené s těmito rozhovory.
Dobrá zpráva? Byty budou dostupnější, ovšem skutečně levné mohou být až za řadu let;Objem nově poskytnutých hypoték na českém trhu poklesl meziročně o 82 procent. O vážnosti situace svědčí, že se o tomto vývoji začaly vyprávět vtipy. Například ten následující. Potkají se dva hypoteční specialisté. Ptá se jeden druhého: „Tak co, kolik jsi minulý měsíc udělal hypoték?“ „Jednu.“ „Aha, tak tos byl ty?“
Česko má své Dahmery: kanibaly i hloupé nekrofily. Kriminalisté popisují modus operandi brutálních vrahů;Vyznačoval se krutostí, která šokovala celý svět. Na platformě Netflix právě běží populární seriál o americkém vrahovi Jeffreym Dahmerovi, jenž v 80. letech zavraždil 17 mladých mužů. Své oběti jedl a těla schovával po celém bytě. I v Česku najdeme sériové vrahy, kteří mají na svědomí podobně brutální činy.
Čínský ekonomický zázrak se vyfukuje, dotýká se to i nás;/ÚHEL POHLEDU/ Když po dlouhé době v roce 1999 spadl reálný růst Číny hluboko na 7,7 procenta, ekonomický svět se tvářil tragikomicky. Byl to výrazný propad růstu, potud šlo skutečně o tragédii, ale 7,7 procenta je stále tak obrovské číslo, že tu tragédii šlo přijmout s úsměvem.
Tisíce Britů v Londýně demonstrovaly za vypsání parlamentních voleb;Tisíce lidí se v sobotu v centru Londýna zapojily do protestní akce vyzývající mimo jiné k vypsání parlamentních voleb a k řešení nízkých mezd. Demonstraci s názvem Britain is Broken (Británie je zlomená) svolala organizace People’s Assembly, informoval server BBC.
„Malá kulturní revoluce“. Francouzské Národní sdružení poprvé neřídí klan Le Penů;Marine Le Penovou nahradí v čele francouzské krajně pravicové strany Národní sdružení (RN) sedmadvacetiletý europoslanec Jordan Bardella. Rozhodli o tom členové strany na sjezdu. Bardella jednoznačně porazil svého protikandidáta Louise Aliota, a stane se tak prvním předsedou strany, který nepochází z rodiny Le Penů.
Záporožská jaderná elektrárna je opět připojena k vnější síti, hlásí MAAE;Rusy okupovaná Záporožská jaderná elektrárna na jihu Ukrajiny je znovu připojena k vnější síti poté, co bylo vnější napájení v noci na čtvrtek přerušeno při ruském ostřelování, které poničilo vedení vysokého napětí. Informovala o tom v sobotu Mezinárodní agentura pro atomovou energii (MAAE).
PETRÁČEK: Je krácení penzí spravedlnost? Nebo spíš akt odplaty na stařících;Heslo vyrovnat se s minulostí je oblíbené, leč zavádějící. Minulost můžeme poznávat – v našem případě zejména tu komunistickou, neboť stále žije dost lidí jí poznamenaných. Můžeme ji interpretovat různými způsoby, o které se vedou spory. Ale jak se s ní můžeme vyrovnat?
Čtvero odmítnutí katastrofismu. Nenechme si negativně ovlivňovat životy;/ÚHEL POHLEDU/ Ještě před několika lety jsme se ujišťovali, že žijeme v nejlepším období lidských dějin, že jsme se nikdy neměli tak dobře z pohledu kvality života a demokracie. Píše se rok 2022 a všechno je vzhůru nohama. Naše vystrašená civilizace, a s ní Česká republika, se naopak ujišťuje, že žijeme v kruhu neustálých krizí a pohrom. Kdo neřekne, že civilizace je na sestupu, je nudný a nezajímavý.
Dobrá zpráva? Byty budou dostupnější, ovšem skutečně levné mohou být až za řadu let;Objem nově poskytnutých hypoték na českém trhu poklesl meziročně o 82 procent. O vážnosti situace svědčí, že se o tomto vývoji začaly vyprávět vtipy. Například ten následující. Potkají se dva hypoteční specialisté. Ptá se jeden druhého: „Tak co, kolik jsi minulý měsíc udělal hypoték?“ „Jednu.“ „Aha, tak tos byl ty?“
Čínský ekonomický zázrak se vyfukuje, dotýká se to i nás;/ÚHEL POHLEDU/ Když po dlouhé době v roce 1999 spadl reálný růst Číny hluboko na 7,7 procenta, ekonomický svět se tvářil tragikomicky. Byl to výrazný propad růstu, potud šlo skutečně o tragédii, ale 7,7 procenta je stále tak obrovské číslo, že tu tragédii šlo přijmout s úsměvem.
Co mají společného Grónsko, odlehlé řecké ostrovy a východní Německo?;Je to jeden z výsledků studie, kterou nedávno zveřejnili sociologové z Berlína. Zapadá do pravidelného bilancování, které se v Německu objevuje vždy v období mezi výročím sjednocení (3. října) a pádem berlínské zdi (9. listopadu).
MACHÁČEK: Green Deal a elektromobilita? Už i na Západě diskuze přitvrzuje;Kritiku Green Dealu z pohledu selského rozumu si v českých médiích stále ještě přečtete docela běžně, a to nepíši o Twitteru či o tom, co si lidé říkají v hospodě. V západní Evropě bylo této kritiky dosud spíše jako šafránu. Ale s tím, jak Evropa reaguje na ruskou agresi na Ukrajině a energetickou krizi „rekordním“ pálením uhlí (měřeno poslední dekádou), začínají se poněkud protrhávat stavidla.
Duhová vlajka, či plyn z Kataru;Zhruba za dva týdny, 20. listopadu, začne dlouho očekávané mistrovství světa ve fotbale v Kataru. Absurdní termín (zima) a bizarní místo (Arabský poloostrov) již delší dobu rozděluje milovníky kopané, ale pokrok, což v tomto případě znamená zájmy mocných sponzorů a s nimi provázané vysoké politiky, asi nelze zastavit. Časy, kdy se tento největší svátek fotbalu konal pouze v Evropě a v Latinské Americe, jsou definitivně pryč.
Problém orgánu. Rady ekonomů se nemusejí potkávat s realitou;Dřív, než začnete trhat na kusy materiály, které Národní ekonomická rada vlády (NERV) připravila pod názvem Návrhy NERV na snížení výdajů a zvýšení příjmů veřejných rozpočtů v ČR, se třikrát nadechněte a vydechněte. Problém těchto nesourodých nápadů neleží v jejich politické neproveditelnosti (u některých), asociálnosti (u mnohých) či u nepochopení sociálního rozměru státu. Problém je ve slůvku ekonomická.
Na flákače musí být přísnost? Panu ministrovi lidově řečeno luplo v palici;Navzdory svému relativnímu mládí je ministr práce a předseda lidovců Marian Jurečka v této vládě jedním z mála zkušených politiků – má za sebou čtyři roky víceméně úspěšného ministrování ve vládě Bohuslava Sobotky. Je i jedním z mála talentovaných politiků, patřil ke generaci, která nadšením a oddaností vrátila KDU-ČSL na politickou mapu poté, co v roce 2010 vypadla ze sněmovny.
Poslední slovo Jaroslava Veise: Putler v pytli (recenze) na budově vnitra;Osmadvacátého října byla osazena na boční fasádu budovy ministerstva vnitra na Letné dočasná výtvarná instalace uměleckého sdružení MV ČR, jehož vůdčí osobností je Vít Rakušan. Artefakt tvoří vlajky Česka a Ukrajiny, mezi nimiž na pláň shlíží z otvoru v černém vaku na zemřelé tvář ruského prezidenta Putina.
Věříte soudruhu Simu? Německo se od Číny ekonomicky neodřízne;Někdy je člověku německého kancléře až líto. Před rokem vyhrál Olaf Scholz nečekaně volby i proto, že působí jako „strejda“, který má domek na předměstí a mercedes. Tedy jako protipól radikálů, které láká zákaz klasických aut i rodinných domků. Scholz není politik stavěný na řešení válek či vztahů s totalitními režimy. Proto se stal otloukánkem už na jaře, když odmítal dodávat Ukrajině účinné zbraně, i teď, když vyjel do Číny.
Dvojí prásk kancléře Scholze. Na úlevu od vysokých cen energií si Němci budou muset počkat;Už skoro měsíc má německá vláda svolení provést tzv. Doppel-Wumms (dvojí prásk). Co to ale vlastně znamená?
Jak porazit Rusko. Západ se chce vyhnout válce, žádá ale výsledky, kterých bez ní nelze dosáhnout;Od počátku války tvrdí Vladimir Putin, že válka je pro Rusko existenční boj a zároveň zápas o světový pořádek. Mnozí lídři na Západě ale docházejí podle komentátora Bloombergu Leonida Beršidského k témuž závěru, jen s opačným znaménkem. Místo pomoci Ukrajině vyhrát má vzniknout nový poválečný světový pořádek, který Rusko odstaví, aby už nikdy nedělalo problémy.
Kde vzít ten drajv. Německo sází na veřejnou dopravu. A my?;Na Německo se v Evropě často nadává. Teď na to, že kompenzačním balíkem (200 miliard eur) jednostranně zvýhodní svůj průmysl a znevýhodní průmysl jiných, ne tak bohatých zemí. Premiér Fiala řekl, že země EU to nepovažují za přijatelné a Evropská komise to nepřipustí. Uvidíme.
Státní svátek. Nemělo by se rozhodování o vyznamenáních změnit?;Sešli jsme se minulý pátek s přáteli, abychom jako každý rok oslavili osmadvacátý říjen. No, oslavili… hymnu jsme nezpívali a hesla jsme taky nepronášeli. Všichni jsme vyrůstali v éře komunismu a jsme na velká slova ostražití, nejsme žádní fangličkáři.
Sleva není zdarma. Stát musí šetřit, ale měl by myslet na následky;Náš stát se zadlužuje rychlostí japonského šinkanzenu a úspory se hledají všude. Není tak překvapivé, že ministr práce a sociálních věcí Marian Jurečka oznámil, že navrhne vládě zkrácení či snížení podpory v nezaměstnanosti. Vychází přitom z návrhu Národní ekonomické rady vlády, která to zdůvodňuje nízkou nezaměstnaností a demotivačním působením podpory.
Větší hrozba než Palestinci. Volby v Izraeli potvrdily proměnu tamní společnosti;Benjamin Netanjahu se po necelém roce a půl vrací na scénu jako staronový premiér Izraele. Takové je zásadní shrnutí výsledků úterních předčasných parlamentních voleb – už pátých za tři roky.
Nemalujte čerta. Ekonomika není odsouzena ke stagnaci;Čekají nás těžké časy, po zdražování přijde propouštění, citují média ekonomy a analytiky. Další tvrdí, že období nedávného růstu se už nikdy nebude opakovat a skončila doba levných energií, a tím i ekonomický růst.
