Disident minulého režimu i rebel současnosti promluvil o Václavu Havlovi. Hodně lidí prý zklamal;ROZHOVOR Slávek Popelka byl v minulém režimu disident, v tomto režimu se o něm dá hovořit minimálně jako o rebelovi. Aktivně se snažil protestovat proti řadě záležitostí, které podle něj škodí naší současné společnosti. Asi největší úspěch zaznamenal s Holešovskou výzvou, i když nakonec i ona upadla v zapomnění. ParlamentníListy.cz se ho nyní však zeptaly na to, jak nahlíží na odkaz Václava Havla, od jehož úmrtí uplynou brzy 3 roky.
Profesor Zelený zavzpomínal na Havla: Byl hříčkou v rukou jiných, netušil, co se kolem něj děje. Chtěl jen debatovat s kumpány ve Slavii;TŘI ROKY BEZ VÁCLAVA HAVLA Profesor ekonomie Milan Zelený si neumí představit, že by eventuální nový„havlovský“ kandidát na prezidenta mohl Česku do budoucna jakkoliv pomoci. Podle něj prý ani sám Havel ne. Jak ParlamentnímListům.cz v rozhovoru na téma odkazu Václava Havla tři roky po jeho úmrtí řekl: „Češi si zvorali své privilegium přímé volby hned napoprvé, doufejme, že naposled. Jinak o tuto demokratickou výsadu zcela zákonitě přijdou." Odhalil však i jiné své názory a pohledy.
Zemřel advokát Kolja Kubíček;Dnes po těžké nemoci zemřel advokát Kolja Kubíček. Muž, který mnohokrát reagoval i na otázky ParlamentníchListů.cz. Informaci o jeho smrti přinesla mimo jiné na sociální síti jeho kolegyně Klára Slámová.
Ombudsmanka Anna Šabatová nám řekla své o muslimských šátcích, exekucích na seniory a slově, které bychom vůbec neměli používat;ROZHOVOR Ochránkyně lidských práv Anna Šabatová v rozhovoru pro ParlamentníListy.cz zdůraznila, že si nevybírá témata, kterými se bude zabývat. Řeší to, s čím se na ni lidé obracejí a co spadá do její působnosti. Některá témata možná pro určité skupiny lidí nejsou zrovna populární, ale i tak je to též práce ombudsmana. Například boj s předsudky... Třeba v případě muslimských šátků.
Karel Srp odkrývá zajímavosti kolem snídaně disidentů s francouzským prezidentem. Co se tehdy dělo kolem Dubčeka?;Před 27 lety musela komunistická státní moc i Státní bezpečnost couvnout před požadavkem prezidenta Francouzské republiky Francoise Mitterranda a povolit společnou snídani s českými disidenty na Francouzském velvyslanectví v Praze. Konala se 9. prosince 1988.
Téměř 60 tisíc nových pracovních míst. O každé z nich se uchází už "jen" devět lidí;Víc než půl milionu Čechů bez práce po dobu delší než 24 měsíců. To není příliš dobrá zpráva. Na druhou stranu přibylo během roku bezmála 60 tisíc nových pracovních míst. Zatímco vloni se o jedno takové volné místo ucházelo v průměru 15 žadatelů o práci, nyní je situace lepší - počet se snížil na 9. A i další čísla ukazují důvod k radosti a optimismu do dalšího roku.
Babišův ministr si mne ruce, jak dobrého člověka posadil na hromadu miliard. Jenže zkušená expertka, která zažila své, mluví jinak;Na jedné straně panuje radost z nového šéfa Ředitelství silnic a dálnic Jana Kroupy, na druhé straně obavy. V té druhé skupině je i bývalá kontrolorka kvality silnic a dálnic na ŘSD Miloslava Pošvářová. ParlamentnímListům.cz vysvětlila, proč se ona domnívá, že nově jmenovaný ředitel není tak dobrou zprávou, jak je prezentováno. Nutno ale dodat, že to, který z táborů má víc pravdy, rozsoudí až čas.
Odborářský matador promluvil o protestech proti Zemanovi. Příznivci Schwarzenberga si prý pokoj jen tak nedají;Červené karty prezidentu Zemanovi a protesty s lidmi v ulicích. Do jaké míry jsou tyto iniciativy sympatické šéfovi Asociace samostatných odborů (ASO) Bohumíru Dufkovi? I on přece před časem organizoval různé protestní akce. Jak ale ParlamentníListy.cz zjistily, v tomto případě by Dufek do ulic s lidmi vyjadřujícími své názory nešel. Řekl proč.
Syn exministra Baudyše připomněl, jak Zeman hájí národní zájmy. A zmínil jednu podivnou iniciativu knížete Schwarzenberga;Miloš Zeman je v posledních týdnech tématem hovorů i rozepří na mnoha místech. Zatímco někteří proti jeho setrvání ve funkci začínají protestovat a organizovat různé akce, druzí se ho zastávají a jsou ochotni jít proti opačnému táboru i do boje – byť většinou hlavně virtuálního, případně slovního. Ať tak, či onak, v každém případě se stále hlasitěji ozývají názory, že právě tento prezident udělal z Čechů dva nesmiřitelné tábory. Jak to tedy je?
Z knihy o vlivném sovětském politikovi: I za cenu 3. světové války potlačme pražské jaro;Gromyko - diplomat války po válce: To je název knihy o dnes už mnohým možná neznámém ruském politikovi, jenž však stál u řady významných historických mezníků. Autor knihy Svjatoslav J. Rybas udělal poměrně hlubokou sondu do těchto událostí, které mohou být užitečné i pro současnost. ParlamentníListy.cz vybraly z kapitoly, která se týká citlivě i naší historie – nazvané Pražské jaro.
Návrat do listopadu '89: Akce „mrtvý student Šmíd" přinesla v ČST překvapení i strach;Televizní střepiny sametu – tak se jmenuje kniha, která by se měla objevit ještě před Vánocemi na pultech knihkupců. Jak její název napovídá – bude ohlédnutím za listopadovými událostmi roku 1989 – ovšem přece jen do značné míry netypickým. Ohlížet se totiž za tímto obdobím budou lidé, kteří pracovali v redakci zpravodajství tehdejší Československé televize.
Pavel Bém vydává knihu. Zmiňuje v ní i jistého prezidenta, který se zhlédl ve falešných ideálech rovnostářství;Bývalý pražský primátor Pavel Bém vydává v těchto dnech knihu. Ten, kdo by se však těšil na pikantérie z politického zákulisí, může si nechat zajít chuť. Bém totiž připravil knihu o svých cestách do hor a výstupu na druhý nejvyšší vrchol světa, nazvaný K2 - Královna hor – s velkým množstvím fotografií a zajímavým doprovodným – místy až filozofickým textem. ParlamentníListy.cz přinášejí exkluzivní ochutnávku.
Tento pán prý možná bude řídit správu všech silnic. Je spojen s problémovými stavbami;Kuloáry, krátce po čtvrtečním uvedení do funkce nového ministra dopravy Dana Ťoka, putuje další informace týkající se klíčových personálních postů. Jak ParlamentníListy.cz zjistily, generálním ředitelem Ředitelství silnic a dálnic se má stát Jan Kroupa. Ten by měl být podle oficiálně však nepotvrzených zpráv, jmenován v nejbližších dnech.
Konec otravného přepínání: Tajný trik, který ocení rodiče malých dětí;Pokoušíte se zabavit dítě pohádkou na telefonu, ale jeho malé zvídavé prstíčky ji neustále vypínají, přepínají jiné aplikace, volají všem z telefonního seznamu a mažou fotografie a dokumenty, o které rozhodně nechcete přijít? Máme pro vás vysvobození prostřednictvím jednoduchého triku. Uzamčením zabráníte obrazovce a tlačítkům na telefonu reagovat na dotyky prstů. Podívejte se, jak na to.
Miroslav Táborský v otevřené zpovědi. Odhalil triky světových režisérů;Málokterý český herec spolupracoval s tolika hollywooodskými hvězdami jako Miroslav Táborský. Tento tak trochu plachý sympaťák slaví koncem týdne 63. narozeniny. V exkluzivním rozhovoru pro Život ve hvězdách prozradil, s kým si na place rozuměl, a dokonce odhalil triky některých světových režisérů.
Stovky mrtvých ryb na Nymbursku. Rybáři jsou zoufalí, situaci řeší hasiči;Stovky mrtvých ryb našli rybáři v jezeře Sadská na Nymbursku. Situace se prý opakuje každoročně. Letos by ale na vině nemusela být změna počasí jako v minulých letech. Podle tamních hasičů mohly masivní úhyn ryb způsobit fekálie.
Policisté zbourali světla na železničním přejezdu. Do spadlé závory narazil vlak;V neděli odpoledne havarovalo v Bubenské ulici na Praze 7 policejní auto. Podle policie vozidlo nabouralo do výstražné světelné signalizace na železničním přejezdu. Policisté během nehody poškodili závoru, o kterou následně zavadil projíždějící vlak.
Žena si pořídila na Halloween děsivé tetování na obličej. Pak nešlo dolů;Šestačtyřicetiletou Elizabeth Roseovou čekalo po Halloweenu nepříjemné překvapení. V rámci svého kostýmu si koupila dočasné tetování na obličej, které ji na děsivý svátek proměnilo ve smrtku. Když však přišel čas odstrojit se, tetování z obličeje nešlo sundat.
Česko bude zemědělcům platit nižší dotace. Nebudeme konkurenceschopní, varují;Podle návrhu ministerstva zemědělství stát v příštím roce vyplatí na národních zemědělských dotacích jen 2,7 miliardy korun. To je téměř o polovinu méně než v posledních letech. Částku ve středu schválil sněmovní zemědělský výbor, organizace tento krok kritizují.
Tvrdý trest pro Meghan a Harryho: Nový král je možná zbaví titulů, tvrdí expert;Přestože zesnulá královna Alžběta II. odmítala podniknout drastické kroky vůči svému vnukovi Harrymu, Karel III. zastává jiné stanovisko. Svému synovi Harrymu a jeho manželce Meghan údajně pohrozil odebráním šlechtických titulů. Stalo by se tak, kdyby princova monografie a připravovaná televizní show jakkoliv pošpinily britskou panovnickou rodinu, tvrdí expert.
Kachovská přehrada je pod palbou, tvrdí Rusové. Může zatopit 80 obcí;Ruské státní tiskové agentury tvrdí, že Ukrajina poškodila Kachovskou přehradu. V neděli podle nich provedli ukrajinští vojáci úder na Kachovskou vodní elektrárnu. Vyslali šest raket HIMARS. Pět z nich bylo sestřeleno, jedna však zasáhla stavidlo přehrady, tvrdí ruská média. Pokud by přehradu rakety zničily, nastala by katastrofa nepředstavitelných rozměrů. Voda by zatopila až 80 obcí v Chersonské oblasti.
WhatsApp chystá velkou změnu. Ušetří svým uživatelům spoustu času;Aplikaci WhatsApp čeká nová funkce. Vývojáři připravili vylepšení skupinových chatů, které umožní jejich vzájemné propojení v takzvané "Komunity". Uživatelům půjde posílat zprávy do více skupin najednou.
K Zemi se blíží tzv. zabiják planet. Obří asteroid má potenciál vyhladit život;Astronomové objevili tři asteroidy v blízkosti naší planety, které se dosud skrývaly v záři Slunce. Jeden z nich je přitom největším pro Zemi potenciálně nebezpečným vesmírným tělesem, které bylo za posledních 8 let objeveno. Přezdívá se mu zabiják planet, protože při střetu se Zemí by způsobil hromadné vymírání, jaké tu nebylo miliony let.
Nemám moc odpočinku, říká Helena Vondráčková. Šílí z nového člena rodiny;Jubilejní turné, práce na zahradě a péče o nového mazlíčka – Helena Vondráčková se na chvilku nezastaví. Pětasedmdesátiletá zpěvačka v nedělní Víkendové Snídani prozradila, že nemá moc odpočinku. Ještě před vyvrcholením turné ji ale konečně čeká vytoužená dovolená u moře.
Začala válka o vedení Kremlu? Oslabený Putin přichází o moc, tvrdí expertka;Ruský prezident Vladimir Putin ztrácí vliv. Konkurující mocenské skupiny země si jdou navzájem po krku a Putin je už nedokáže zastavit, což může ohrozit celý politický režim Ruska. Uvnitř Kremlu tak nastal boj o Putinovo místo, řekla odbornice.
Nejsem jako Čestmír Mázl, tvrdí Hřib. V Praze zůstane, usiluje o koalici;Zdeněk Hřib (Piráti) byl v rámci Víkendové Snídaně hostem pořadu Napřímo Báry Divišové. Hlavním tématem byla komplikovaná povolební situace v Praze. "My nic neblokujeme. Tento stav mě netěší," tvrdí Hřib. Koalice SPOLU je ale opačného názoru.
Žena renovovala byt. Pod tapetou objevila vzkaz od původního majitele;Ženu po přestěhování do nového bytu čekal pořádný šok. Když se rozhodla, že svůj nový domov zútulní podle svého, objevila něco, co rozhodně nečekala. Původní majitel napsal na zeď jasnou zprávu.
Nejhorší ruská porážka. Celý prapor rozstřílelo dělostřelectvo. Až 500 mrtvých;Jednu z nejhorších porážek utrpěla v uplynulých dnech ruská armáda u města Svatove v Luhanské oblasti na severovýchodě Ukrajiny. Podle přeživších vojáků tam celý prapor zmobilizovaných záložníků zlikvidovalo ukrajinské dělostřelectvo. Přeživší voják vypověděl, že důstojníci hned na začátku ukrajinského útoku utekli. Podle něj má masakr přes 500 obětí.
V Tanzanii havarovalo letadlo. Dopadlo do Viktoriina jezera;V Tanzanii havarovalo dopravní letadlo. Při pokusu o přistání dopadlo do Viktoriina jezera. Na místě zasahují záchranáři. Na palubě bylo 43 lidí, 19 zemřelo.
Na Karlovarsku shořel Penny Market. Prodejna je kompletně zničena;K požáru prodejny Penny Market v Chodově na Sokolovsku vyjížděli v neděli brzy ráno tamní hasiči. Požár se brzy podařilo lokalizovat, na místě už ale nebylo co zachraňovat. Objekt je požárem kompletně zničený.
Nevšední rekordman: Covid měl nejdéle na světě, teď je konečně negativní;Muž z Turecka je držitelem poměrně nevšedního rekordu. Měl nejdelší covidovou infekci na světě. Nyní se ale dočkal zázraku – konečně mu vyšel negativní test!
Mrazivá slova z Kremlu. Putin odkázal na Nagasaki a Hirošimu;Ruský prezident Vladimir Putin znepokojil francouzského prezidenta Emanuela Macrona při jednom z jejich telefonátů. Během rozhovoru se prý Putin odkázal na jaderné útoky v Nagasaki a Hirošimě. Ty během války zabily 129 tisíc až 226 tisíc lidí. Japonsko se v důsledku jaderného útoku vzdalo.
I pálení žáhy může být známkou infarktu. Klíčové příznaky a jak poznat rozdíl;Některé příznaky srdečního infarktu jsou velmi specifické. Další se objevují i při jiných zdravotních potížích, jako třeba při refluxních chorobách jícnu, pálení žáhy nebo pankreatitidě. Odborníci popsali klíčové příznaky, na které by si lidé měli dávat pozor. V opačném případě riskují vážné zdravotní komplikace.
Horoskop na neděli 6. listopadu: Dnes můžete dokázat nemožné!;Dnes mají planetární vládci za lubem malou reorganizaci. Chtějí, aby vaše životní hodnoty byly přeskládány do správného pořadí. Čilý Mars se od samotného rána vrhá do vašich vod a nabíjí vás. Můžete dokázat dnes i nemožné.
Halinu nejde nemilovat, ani přehlédnout. České celebrity slavily ve velkém;V posledních dnech se v Česku křtilo, pilo i zpívalo. Oblíbená spisovatelka Halina Pawlowská pokřtila svou 36. knihu. Světlo světa spatřila už také kuchařka vítězky minulé řady MasterChef Česko Besky a pozadu nezůstala se křty ani skupina Olympic. Štáb pořadu Život ve hvězdách při této příležitosti vyzpovídal české celebrity.
Čína je nebezpečnější, než se myslelo. Americký velitel odhalil znepokojivou věc;Válka na Ukrajině je podle velitele americké armády jenom zahřívacím kolem. Pravé nebezpečí se skrývá v Číně, která je mocnější, než si USA byly ochotny dosud připustit. Peking totiž vyrábí jaderné zbraně podstatně rychleji než Washington a brzy ho tak předežene.
Na fotce na občanku se smát nesmíte, rozhodl soud. Muži nepomohla ani víra;Kuriózní případ řešil Městský soud v Praze. Obrátil se na něj muž, kterému vadilo, že se na fotografii na občanském průkazu nemůže usmívat.  Argumentoval tím, že je člen církve smíchu Ecclesia Risorum a jeho víra mu přikazuje se smát. Soud ale trvá na tom, že na dokladu je nutné mít neutrální výraz. Církev plánuje podat kasační stížnost.
Téměř čtvrtina dětí ochutnala alkohol už v pěti letech, prozradila studie;Vědci z Masarykovy univerzity v Brně zjistili znepokojivou informaci. Zkušenost českých dětí s alkoholem začíná už v útlém věku. Ve věku pěti let ho ochutnala skoro čtvrtina dětí. Odborníci přitom odhadují, že problémy s pitím má v tuzemsku více než milion lidí.
Španělské policii se podařilo zabavit rekordních 32 tun marihuany! Jde o historicky největší množství;Policisté při sérii razií po celém Španělsku objevili dosud největší náklad konopí. Úřady uvedly, že zabavily více než 32 tun této drogy, jejíž hodnota se na ulici se podle BBC odhaduje na více než 64 milionů dolarů.
Ve 34 letech zemřel světoznámý zpěvák. Nalezli ho mrtvého ve vaně;Aaron Carter, rapper, herec a dětská popová hvězda 90. let zemřel. Úmrtí potvrdil CNN zdroj blízký rodině. Bylo mu 34 let. Zpěvákovo tělo bylo podle více zdrojů objeveno ve vaně.
Další útok v galerii! Aktivisté se ve Španělsku přilepili na Goyovy obrazy;V madridském muzeu Prado opět útočili aktivisté. Na zeď mezi dvěma světoznámými obrazy španělského mistra Francisca de Goyi napsali nápis "+1,5 C" a poté si přilepili ruce k rámům obrazů, informuje agentura Reuters. Jde o zatím poslední z řady klimatických protestů směřovaným proti uměleckým dílům po celé Evropě. Podobným způsobem aktivisté naposledy protestovali v římské galerii, kde polili známý obraz Vincenta van Gogha hrachovou polévkou.
Cena polí a luk v Čechách roste. Investice do půdy se vyplatí, tvrdí experti;Investice do pozemku je momentálně sázkou na jistotu. V posledních letech rostou podle odborníků ceny pozemků určených pro výstavbu i těch zemědělských. Důvodem jejich vysokých cen je poptávka, která převyšuje nabídku.
Lidé začínají topit vším, co hoří. Mohou si však zažádat o dotaci na nový kotel;Vysoké ceny energií můžou do Česka vrátit zimní smog. Především v malých obcích je znát, že lidé topí vším, co hoří.  Do ovzduší se tak dostává prach, nebezpečné škodliviny a dým. Odborníci proto chtějí rozborem zplodin zjišťovat, čím lidé topí a zkontrolovat kvalitu vzduchu. Řešením však mohou být dotace na nové kotle. Občané stále mohou získat až 140 tisíc korun.
Přibývá lidí s depresemi. Pojišťovny ale psychické problémy nechtějí pojišťovat;V Česku přibývá lidí s depresemi a úzkostmi. Podle odborníků za to může přetrvávající nejistota způsobená pandemií a válkou na Ukrajině. Problém ale je, že řada pojišťoven psychické problémy nepojišťuje, protože jsou prý lehce zneužitelné. Případů, kdy se lidé snaží deprese jen předstírat, není totiž vůbec málo.
Medvěd na Konopišti je deprimovaný, tvrdí aktivisté. Má mít víc hraček;Podle aktivistů ze skupiny OBRAZ jsou na zámku Konopiště týrána zvířata. Obětí má být šestnáctiletý medvěd Jirka, který má nevyhovující výběh a kvůli tomu na něj doléhá stres a prý i nechuť k životu. Vedení zámku ale jakékoliv špatné zacházení se zvířetem odmítá.
Archeologové slaví výročí přelomového objevu. Uplynulo od něj už sto let;Archeologové slaví sto let od momentu, kdy se jim v Egyptě podařil přelomový objev. Tehdy našli téměř neporušenou, přes tři tisíce let starou hrobku plnou zlata a zlatých artefaktů zdánlivě nevýznamného faraona Tutanchamona.
Nedělní Víkendová Snídaně je za rohem. Podívejte se, co vás čeká;Víkendová Snídaně už na obrazovkách televize Nova běží čtvrtým týdnem. Poslední moderátorská dvojice, která se ve vysílání ještě neobjevila, si v sobotu ráno odbyla společnou premiéru. Herečka Miluše Bittnerová se postavila po bok zkušeného Pavla Svobody, který moderuje Snídani už téměř 30 let. V neděli se na televizních obrazovkách objeví znovu.
V Českém Švýcarsku bude kraj dotovat turisty. Podpoří tím podnikatele;Ústecký kraj bude turistům dotovat ubytování v Českém Švýcarsku. Dostanou tři sta korun na noc a navíc dopravu po kraji zdarma. Vedení kraje tím chce podpořit tamní podnikatele, kteří jsou na ubytovacích službách závislí. Nejdřív jim tvrdou ránu zasadil covid a o další příjmy přišli kvůli požáru parku v Českém Švýcarsku.
Vejce prudce zdražila. A před Vánoci bude ještě hůř, varují ekonomové;Tak jako téměř všechno, zdražují i vajíčka. Před měsícem stálo 30kusové balení o desítky korun méně než dnes. O zdražování vajec se mluvilo už na jaře, ale vypadá to, že jejich cena bude mnohem vyšší, než se očekávalo.
Na svatého Martina bude veselo. Vinaři tradičně stáčí svatomartinské víno;Se začátkem listopadu začínají vinaři se stáčením takzvaných svatomartinských vín, která se podle tradice mohou začít prodávat od 11. listopadu. Letos by mělo být v prodeji rekordní množství lahví, a to přes dva a čtvrt milionu.
Zimní sezona se blíží. O kolik zdraží v Česku a okolních zemích? PŘEHLED;Zimní sezona na horách se blíží a tak je logické, že se lidé zajímají o to, kolik nás to bude stát. Jisté je zatím jen jedno, bude to dražší než loni. Otázkou ale je o kolik. A právě to zjišťovaly štáby televize Nova v horských střediscích v Česku i v okolních státech.
Zoufalá situace v Rokytnici. Obyvatelům zastavili dodávky tepla;V Rokytnici v Orlických horách se opakuje situace z léta. Dodavatel tepelné energie přerušil dodávky a stovky domácností se tak ocitly bez tepla a teplé vody. Tentokrát však obyvatelé těžké situaci čelí při podstatně nižších teplotách. Důvodem přerušení jsou spory mezi dodavatelem a vedením města ohledně cenové nabídky.
Kate všechny dojala. Zesnulé královně vzdá úctu krásným gestem;Princeznu z Walesu Kate Britové zkrátka milují. Sama jim k tomu často dává patřičné důvody a ani po odchodu britské královny Alžběty II. nezahálí. Na královny počest uspořádá vánoční bohoslužbu.
Policie šetří vraždu ve Vysokém Mýtě. Podezřelý se otrávil, v nemocnici zemřel;V sobotu ráno vyjížděli pardubičtí policisté do Vysokého Mýta, kde násilnou smrtí zemřel muž středního věku. Podezřelého se policistům podařilo zadržet, ještě před tím se ale otrávil neznámou látkou a po převozu do nemocnice zemřel.
Pavol Habera má vážné zdravotní potíže. Známý zpěvák skončil v nemocnici;Legendární slovenský zpěvák Paľo Habera skončil v nemocnici. Na sociální sítích sdílel fotku, kde leží na nemocničním lůžku s obvázaným kolenem. Berle má opřené opodál. Nakreslená šipka nad jeho obvazy naznačuje, že porotce ze SuperStar musel na operaci.
Řidička ve Švýcarsku vystoupila, aby si dala věci do kufru. Její auto ji třikrát přejelo;Pětačtyřicetiletou ženu ve Švýcarsku přejelo ve čtvrtek třikrát její vlastní auto. Řidička z nastartovaného vozu na okamžik vystoupila, aby se podívala do kufru, auto se ale rozjelo z kopce. Žena skončila s těžkými zraněními v nemocnici, uvedla tamní městské policie.
Nehoda kamionu zkomplikovala dopravu. Zraněný řidič nadýchal 2,5 promile;Vážná nehoda u nájezdu na dálnici D3 u Českých Budějovic zkomplikovala v sobotu ráno dopravu. Na kruhovém objezdu havaroval řidič kamionu. Podle policie nadýchal bezmála 2,5 promile.
Putin přichází o dalšího spojence! Od Číny dostal drsný vzkaz;Čínský prezident Si Ťin-pchin hovořil s německým kancléřem Olafem Scholzem. V Pekingu údajně jednali zejména o válce na Ukrajině. Následná slova čínského prezidenta mnohé překvapila. Nepřímo totiž zkritizoval Rusko za výhružky jadernými zbraněmi.
Američané odhalili původ některých UFO. Nic prý není tak, jak se zdá;Americká vláda začala vyšetřovat údajná historická setkání s UFO. Podle nejnovějších poznatků ale bylo všechno jinak, než se lidé domnívají. Ve většině případů na obloze sledovali místo mimozemšťanů čínské drony a meteorologické balóny.
Fanoušci Dary Rolins šílí! Prozradila detaily o koncertu i stěhování do Itálie;Ve Víkendové Snídani na Nově vystoupila v sobotu i známá zpěvačka Dara Rolins a divákům práskla hned několik novinek! Rozpovídala se nejen o plánovaném koncertu, ale i o tom, proč její dcera Laura přestupuje na novou školu. Pozornější fanoušky hned napadlo, jestli nepůjde o školu v Itálii.
Tragédie v ruském nočním klubu. Při požáru zemřelo nejméně 15 lidí;Při požáru v nočním klubu v ruském městě Kostroma zemřelo nejméně 15 lidí. Rozsáhlý požár zřejmě způsobila použitá pyrotechnika. Podezřelého se policistům podařilo zadržet.
Údajná milenka Vémoly lituje: Mámu to mrzí, Karlose mám furt ráda;Kauza MMA zápasníka Karlose Vémoly a jeho údajné milenky Hany Džurbanové vystupující pod přezdívkou Rika Fane nabývá stále větších rozměrů. Vémola řekl, že na ni podal trestní oznámení. Džurbanová promluvila o tom, jak aféru vnímá její rodina a prozradila další detaily.
Horoskop na sobotu 5. listopadu: Vášeň dnes bude mocná;Venuše v opozici Uranu si vás hodlá hýčkat, podporovat a dá vám najevo svou přízeň. Dnes budete vystaveni milostnému pokušení. K setkání s osudovým člověkem vám mohou pomoci sourozenci nebo sousedi. Vášeň bude silná.
Fiala: Tato vláda euro nepřijme. Realistický je rok 2030, míní Pekarová Adamová;Fiala dodal, že chce vláda umožnit firmám, aby mohly vést své účetnictví v eurech.
