Rokytnice v Orl. horách se kvůli zastavení dodávek tepla obrátí na ERÚ;Rokytnice v Orlických horách (Rychnovsko) - Rokytnice v Orlických horách, kde v sobotu soukromý výrobce tepla přerušil dodávky, se hodlá obrátit na Energetický regulační úřad (ERÚ)....
V Chodově na Sokolovsku požár zničil obchod Penny Market;Chodov (Sokolovsko) - Rozsáhlý požár zachvátil dnes obchod Penny Market v Chodově na Sokolovsku. Hořet začalo brzo ráno, před otevřením obchodu. Hasiči na místo původně vyslali 15 jednotek...
Fiala: ČR přistoupí k závazku snížit emise metanu nejméně o 30 %;Praha - Česko se chystá na nynější klimatické konferenci přistoupit ke globálnímu závazku snížit do roku 2030 nejméně o 30 procent emise metanu v porovnání s rokem 2020. Tímto krokem...
Válek konkrétní návrh nadstandardů ve zdravotnictví nyní nepřipravuje;Praha - Ministr zdravotnictví Vlastimil Válek (TOP 09) uvedl, že konkrétní návrh nadstandardů ve zdravotnictví nyní nepřipravuje. Svým příspěvkem na toto téma na sobotní programové...
Vědci našli v rožmberské hrobce snubní prsten Petra Voka a jeho ženy;Třeboň (Jindřichohradecko) - Vědci prokázali, že v rožmberské hrobce ve vyšebrodském klášteře je snubní prsten posledního rožmberského páru, Petra Voka z Rožmberka a Kateřiny z...
Lipavský: Je důležité udržovat s Ruskem aspoň nejzákladnější diplomatické styky;Praha - Ministr zahraničí Jan Lipavský (Piráti) pokládá za důležité udržovat aspoň nejzákladnější diplomatické vztahy s Ruskem, byť se jeho režim chová s ohledem na agresi vůči...
ČR by podle většiny uchazečů o Hrad měla vydávat na obranu dvě procenta HDP;Praha - Česká republika by měla vydávat dvě procenta HDP na obranné výdaje. Jsou o tom přesvědčeni téměř všichni kandidáti na prezidenta, kteří odpověděli na anketu ČTK. Někteří...
V sobotu přibylo 144 nově nakažených, o jednotky méně než před týdnem;Praha - V Česku testy v sobotu potvrdily 144 nově nakažených koronavirem, o jednotky případů méně než před týdnem. Počet hospitalizovaných s potvrzenou nákazou klesl na 543, nemocniční...
Kalousek: TOP 09 by měla žádat vládu o úpravu rozpočtového výhledu;Praha - TOP 09 jako koaliční straně nezbývá než podpořit návrh státního rozpočtu na příští rok, byť je strašný, řekl ČTK a Hospodářským novinám na dnešní stranické programové...
Ministr Válek chce vrátit do hry nadstandardy ve zdravotnictví;Praha - Ministr zdravotnictví Vlastimil Válek (TOP 09) chce vrátit do hry nadstandardy ve zdravotnictví.  Na dnešní stranické programové konferenci v Praze připustil, že zavedení nadstandardů...
Pekarová Adamová: Realistický termín pro přijetí eura je rok 2030;Praha - Předsedkyně TOP 09 Markéta Pekarová Adamová označila na dnešní stranické programové konferenci v Praze rok 2030 za naprosto realistický pro přijetí společné evropské měny euro....
Prezidentští kandidáti: Legálním uprchlíkům by ČR měla pomáhat;Praha - Legálním uprchlíkům by Česká republika měla pomáhat, domnívají se prezidentští kandidáti, kteří odpověděli na anketu ČTK. Pozor si ale stát musí dát na tzv. nelegální...
Na Ukrajině jsou pro vojenské účely využívány i civilní vesmírné technologie;Praha - V konfliktu na Ukrajině jsou pro vojenské účely využívány i vesmírné technologie, které původně byly určeny pro civilní potřeby. Příkladem mohou být třeba systém používaný...
Většina lidí má nárok na bonus od pojišťovny, pokud chodí na prohlídky k lékaři;Praha - Většina lidí bude mít od příštího roku nárok na finanční příspěvek od zdravotní pojišťovny, pokud v posledních dvou letech byli na preventivní prohlídce u praktického lékaře...
Za pátek v ČR 639 nových případů covidu, nejméně za všední den od konce června;Praha - V Česku v pátek laboratoře potvrdily 639 nových případů koronaviru, nejméně ve všední den od konce června. V mezitýdenním srovnání je to zhruba o 500 více, minulý pátek byl...
Webové stránky vlády čelí podle Strakovy akademie masivnímu DDoS útoku;Praha - Webové stránky vlády čelí v posledních dnech masivním DDoS útokům, uvedla dnes Strakova akademie na twitteru. I přes efektivní obranu podle ní mohou být stránky v některých...
Za střežení pobaltského nebe dnes bylo oceněno víc než 120 vojáků;Praha - Více než 120 vojáků bylo dnes na pražském Vítkově oceněno za půlroční nasazení při ochraně pobaltského nebe. Jednotka se od začátku dubna do konce září podílela se stíhacími...
Prominentům komunistického režimu zřejmě klesnou důchody;Praha - Prominentům bývalého komunistického režimu zřejmě klesnou starobní penze. Snížení bude činit 300 korun procentní výměry důchodu za každý i započatý rok výkonu některé...
Policie obvinila muže z pokusu dvojnásobné vraždy seniorů v Postřelmově;Olomouc - Policie obvinila devatenáctiletého mladíka z pokusu dvojnásobné vraždy seniorů v Postřelmově na Šumpersku. Šlo o vnuka jednoho z napadených. Oba muže napadl vojenským nožem,...
Opilý řidič boural na D1 za Brnem do policejní dodávky, čtyři lidé těžce zraněni;Domašov (Brněnsko) - Opilý řidič dnes dopoledne narazil na dálnici D1 za Brnem osobním autem zezadu do policejní dodávky. Při nehodě se zranili čtyři lidé včetně dvou policistů. Jeden...
Sněmovna zatím nezrušila automatické zřizování datových schránek pro obyvatele;Praha - Sněmovna zatím nerozhodla o zrušení automatického zřizování datových schránek pro obyvatele od příštího roku. Návrh poslance STAN Petra Letochy měla v rámci novely o digitálních...
Fiala se na okraj klimatického summitu v Egyptě setká s prezidentem Sísím;Praha - Premiér Petr Fiala (ODS) se příští týden v egyptském letovisku Šarm aš-Šajch zúčastní začátku klimatické konference OSN, v programu třídenní cesty má i bilaterální jednání...
Primátorkou Třince se opět stala Věra Palkovská (Osobnosti pro Třinec);Třinec (Frýdecko-Místecko) - Primátorkou Třince na Frýdecko-Místecku se dnes opět stala Věra Palkovská (Osobnosti pro Třinec). Na ustavujícím zasedání pro ni hlasovalo 18 z 33 přítomných...
Policisté pátrají po muži, který podle nich v březnu v Praze napadl čtyři lidi;Praha - Policisté pátrají po Gruzínci, který podle nich v březnu v Praze 4 během tří hodin napadl čtyři lidi. Jako uprchlý je obviněn z těžkého ublížení na zdraví, vydírání a...
Podnikatel Diviš nasbíral dost podpisů pro prezidentskou kandidaturu;Praha - Podnikatel Karel Diviš nasbíral přes 60.000 podpisů pro svou prezidentskou kandidaturu. Na ministerstvu vnitra je odevzdá v úterý ráno, řekl dnes na tiskové konferenci v Praze. Do...
Národní park Šumava připravuje na příští rok demolici Roklanské chaty;Vimperk (Prachaticko) - Šumavský národní park připravuje na příští rok demolici Roklanské chaty, která se nachází u vrcholu Březník poblíž Modravy na Klatovsku. Důvodem je podle parku...
Kvůli poruše zabezpečovací zařízení stály na koridoru u Olomouce vlaky;Olomouc - Kvůli poruše zabezpečovacího zařízení byl ráno zhruba na hodinu zastaven provoz vlaků na železničním koridoru mezi stanicemi Moravičany na Šumpersku a Červenka na Olomoucku....
Žena ze Zlínska poslala podle policie domnělému kanadskému herci 620.000 korun;Zlín - Žena ze Zlínska postupně poslala podle policie domnělému kanadskému herci 620.000 korun, peníze si na to i půjčila v bance. Seznámila se s ním přes internet. Případem podvodu...
Babiš podal kandidaturu na prezidenta, podpořilo ho 56 poslanců ANO;Praha - Předseda hnutí ANO a bývalý premiér Andrej Babiš podal dnes ráno na ministerstvu vnitra kandidaturu na prezidenta. Podepsalo mu ji 56 poslanců jeho hnutí. Babiš to po odevzdání...
Charita hledá dárce pro vánoční balíčky určené dětem z Ukrajiny, je jich 370;Olomouc - Olomoucká Arcidiecézní charita (ACHO) vyhlásila tradiční sbírku s názvem Vánoční balíček pro Ukrajinu. Do projektu bylo tentokrát zařazeno 370 dětí ze sociálně slabých...
Lucerna byla na koncertu Pocta Martě svědkem výjimečného vystoupení Kubišové;Praha - Zaplněná Lucerna dnes byla na koncertu Pocta Martě svědkem výjimečného vystoupení Marty Kubišové, která při této příležitosti zazpívala slavnou Modlitbu a společně s ostatními...
Pražští zastupitelé přerušili ustavující zasedání do 24. listopadu;Praha - Pražští zastupitelé přerušili dnešní ustavující zasedání do 24. listopadu. Hlavní město tak ani více než měsíc po komunálních volbách nemá nové vedení. Volba primátora,...
Funkce odborných náměstků zřejmě zaniknou, počet politických nebude omezen;Praha - Funkce odborných náměstků na ministerstvech pravděpodobně zaniknou a zruší se také omezení v počtu náměstků členů vlády. Předpokládá to koaliční novela služebního zákona,...
Bývalý rektor Zima: Kandidaturu na Hrad mi podepsali současní i bývalí senátoři;Praha - Prezidentskou kandidaturu bývalého rektora Univerzity Karlovy Tomáše Zimy podepsali senátoři napříč politickými stranami, jsou mezi nimi členové horní komory Parlamentu ze současného...
Vyznamenání ministerstva obrany dostali Mašínová, Drábová či Dědek;Praha - Přes čtyři desítky vojáků i civilistů dnes obdržely vyznamenání ministerstva obrany. Mezi oceněnými jsou Zdena Mašínová, předsedkyně Státního úřadu pro jadernou bezpečnost...
Soud v daňové kauze státní zástupkyně nerozhodl, předvolá si svědky;Praha - V případu státní zástupkyně Sylvy Krützner, která čelí obžalobě z úmyslného neodvedení daně při prodeji bytu, chce soud před vynesením rozhodnutí slyšet dva svědky. Krützner...
Fiala chce nechat Hladíkovi na vyjasnění jeho kauzy čtyři týdny;Praha - Premiér Petr Fiala (ODS) chce čekat na vyjasnění situace kolem kandidáta na ministra životního prostředí Petra Hladíka (KDU-ČSL) čtyři týdny, setkal se s ním a vyslechl jeho...
Katolická církev loni měla zisk 646 milionů Kč, meziročně o 270 milionů více;Praha - Hospodaření české katolické církve skončilo loni se ziskem 646 milionů korun, což bylo meziročně o 270 milionů korun více. Církvi klesly oproti roku 2020 příjmy v podobě státního...
Teprve popáté od začátku 20. století zažilo Česko říjen bez sněhu;Praha - Zatímco v září na českých horách několikrát drobně sněžilo, v říjnu nezaznamenala sníh žádná ze stanic Českého hydrometeorologického ústavu (ČHMÚ), a to ani na hřebenech...
Zeman vetoval novelu rozpočtu na letošek. Vadí mu nižší příjmy;Praha - Prezident Miloš Zeman vetoval novelu rozpočtu na letošní rok. Vadí mu, že příjmy jsou nižší, než by mohly být, pokud by byla nejprve přijata novela zákona o daních z příjmů....
Policie navrhla zastavit stíhání obviněného z dvojnásobné vraždy na Náchodsku;Hradec Králové - Policie navrhla státnímu zastupitelství zastavit trestní stíhání muže obviněného z červnové dvojnásobné vraždy na Náchodsku. Šestatřicetiletý muž nebyl podle...
Senát schválil zákon, který při zakázkách zvýhodní nízkoemisní vozidla;Praha - Zadavatelé budou muset u zakázek na zajištění veřejné dopravy stanovit minimální podíl vozidel s nízkými nebo nulovými emisemi. Vládní návrh nového zákona o podpoře nízkoemisních...
MZV doporučuje kvůli bezpečnostní situaci jen nezbytné cesty do Íránu;Praha - Ministerstvo zahraničí doporučuje kvůli zhoršené bezpečnostní situaci cestovat do Íránu jen ve zcela nezbytných případech. Při protestech v zemi dochází k násilnostem. Česká...
Babiš navrhl zavedení jednokolových voleb do Senátu;Praha - Předseda opozičního hnutí ANO Andrej Babiš navrhl zavedení jednokolových voleb do Senátu. Poukazuje na nízkou účast voličů při nynějších druhých kolech, volby by navíc podle...
Cenu Michala Velíška dostal muž, který skočil do řeky pro tonoucí holčičku;Praha - Osmačtyřicetiletý Petr Jirout skočil na konci srpna z mostu v Chrudimi, aby zachránil topící se dvouletou holčičku, která vypadla z okna. Dnes za to dostal Cenu Michala Velíška...
Senátor Fischer podal kandidátní listinu do prezidentských voleb;Praha - Senátor Pavel Fischer dnes podal kandidátní listinu do prezidentských voleb, podepsalo mu ji 54 poslanců a senátorů. Kandidaturu mu podpořili i čtyři senátoři z předchozího volebního...
Česká ambasáda v Berlíně má kvůli cenám energií problém vystačit s penězi;Praha - České velvyslanectví v Berlíně kvůli vysokým cenám energií v zásadě nevystačí s přidělenými penězi. Budou se hledat náhradní prostory a je snaha zrychlit plánovanou rekonstrukci...
Vodákům za plavbu pod mírným vlivem alkoholu zřejmě nebude hrozit pokuta;Praha - Vodáci zřejmě nebudou od příští sezony pokutováni za plavbu pod mírným vlivem alkoholu na vybraných úsecích tuzemských řek. Senát to dnes hladce schválil beze změn v novele...
Premiér: EK nepřipustí jednostranné zvýhodnění německého průmyslu;Praha - Státy EU podle premiéra Petra Fialy (ODS) považují za nepřijatelné, aby Německo jednostranně zvýhodnilo svůj průmysl. Podle kritiků by chystané uvolnění až 200 miliard eur (téměř...
Sněmovní zahraniční výbor označil současný ruský režim za teroristický;Praha - Sněmovní zahraniční výbor dnes v usnesení označil současný ruský režim za teroristický. Odsoudil zejména rozsáhlé útoky na ukrajinské civilní obyvatelstvo či klíčovou infrastrukturu....
Při nehodě dopravního letadla v Tanzanii zahynulo nejméně 19 lidí;Dáresalám - Při dnešní nehodě dopravního letadla místních aerolinií v Tanzanii zemřelo nejméně 19 lidí. Podle médií to oznámil tanzanský premiér Kassim Majaliva. Počet obětí se...
Rusko tvrdí, že Ukrajinci ostřelovali přehradu u Kachovské vodní elektrárny;Kyjev/Moskva - Ukrajinské síly dnes ostřelovaly z raketometů HIMARS Kachovskou vodní elektrárnu na jihu Ukrajiny a zasáhly stavidlo přehrady, tvrdí ruské tiskové agentury. Odkazují na vyjádření...
NYT: Vedení Kyjeva se připravuje na scénář úplného blackoutu ve městě;Kyjev - Vedení Kyjeva připravuje scénář evakuace všech obyvatel města pro případ, že by v něm nastal úplný výpadek proudu. Napsal to deník The New York Times, který se odvolává na...
Slovenští autodopravci chtějí v noci zablokovat D2 na hranicích s ČR;Kúty-Brodské (Slovensko)/Lanžhot (Břeclavsko) - Slovenští autodopravci v noci z dneška na pondělí kvůli stávce zablokují dálnici D2 z České republiky na Slovensko. S odkazem na Unii...
Meteorologové: Oteplování planety i stoupání hladin oceánů zrychluje;Šarm aš-Šajch (Egypt) - Oteplování planety i stoupání hladin oceánů zrychluje, posledních osm let bylo nejteplejších v historii záznamů a odtávání ledovců už nic nezastaví. Ve své...
Rusko ostřelovalo v noci rezidenční oblast v Záporoží, tvrdí Ukrajina;Kyjev - Ruské síly v noci na dnešek ostřelovaly rezidenční čtvrť v Záporoží na jihu Ukrajiny, uvedl tajemník záporožské radnice Anatolij Kurtěv. Útok si podle něj vyžádal jeden...
Vítězství republikánů je nutné k záchraně amerického snu, řekl Trump;Latrobe (USA) - Vítězství republikánů ve volbách do amerického Kongresu je nutné, aby se zastavilo ničení země a zachránil americký sen. Řekl to na předvolebním mítinku v Pensylvánii...
Dívka z britského zařízení pro migranty hodila novinářům zoufalý vzkaz v lahvi;Londýn - Mladá dívka, která pobývá v zařízení pro migranty v anglickém Manstonu, hodila britským novinářům přes plot vzkaz v lahvi, kde popisuje zoufalé podmínky uvnitř tábora. Napsal...
Biden: Volby do Kongresu budou "rozhodující" pro demokracii USA;Filadelfie (USA) - Úterní volby do Kongresu budou "rozhodujícím" momentem pro budoucnost americké demokracie. Řekl to dnes americký prezident Joe Biden na velkém předvolebním mítinku...
Záporožská jaderná elektrárna byla opět připojena k vnější síti;Vídeň/Kyjev - Rusy okupovaná Záporožská jaderná elektrárna na jihu Ukrajiny byla opět připojena k vnější síti poté, co bylo vnější napájení v noci na čtvrtek přerušeno při ruském...
Írán potvrdil, že Rusku dodal drony. Tvrdí, že tak učinil ještě před válkou;Teherán/Moskva/Kyjev - Írán dnes poprvé potvrdil, že Moskvě dodal drony, upozornila agentura Reuters. Íránský ministr zahraničních věcí Hosejn Amírabdolláhján sdělil, že Teherán...
KLDR odpálila čtyři rakety, do cvičení v Jižní Korejí zapojí i bombardéry B-1B;Pchjongjang/Soul - KLDR dnes odpálila další čtyři balistické rakety krátkého doletu, všechny dopadly do moře. Informovala o tom jihokorejská armáda. Pchjongjang tento týden provedl desítky...
Scholz ocenil Čínu za jasný postoj vůči ruským jaderným pohrůžkám;Berlín - Německo bude pokračovat v rozvíjení hospodářských vztahů s Čínou, ale sníží svou závislost. Dnes to podle agentury Reuters řekl německý kancléř Olaf Scholz, který byl...
Při požáru v nočním klubu v Rusku zemřelo 13 lidí;Moskva - Při požáru v nočním klubu v ruském městě Kostroma zemřelo v noci na dnešek 13 lidí, oznámily podle ruského servisu BBC úřady. Ráno záchranáři hovořili o 15 mrtvých, ale...
Írán hlásí úspěšný test vesmírné rakety;Teherán - Írán dnes úspěšně vyzkoušel novou třístupňovou raketu Ghaím-100, která je určena k vynesení satelitů na oběžnou dráhu, informovala podle zahraničních agentur íránská...
CNN: Na Ukrajině nefunguje přes 1000 terminálů Muskovy satelitní sítě;Kyjev - Na Ukrajině bylo zhruba před dvěma týdny kvůli nezaplaceným účtům odpojeno 1300 terminálů potřebných pro připojení k satelitní síti Starlink provozovanou společností SpaceX...
Zelenskyj: Rusko o míru vyjednávat nechce, na bojiště stále posílá nové vojáky;Kyjev - Rusko nechce s Ukrajinou vyjednávat o ukončení války, stále posílá na bojiště tisíce nových vojáků a skrytě pokračuje v částečné mobilizaci, kterou už označilo za skončenou....
AP: Jak si vlastně chudá KLDR může dovolit tolik raketových testů?;Pchjongjang - Severní Korea tento týden uskutečnila  řadu raketových testů, při kterých vypustila nejméně dvě desítky střel, a to včetně jedné mezikontinentální balistické rakety...
Jihem USA se přehnala tornáda, jeden člověk zemřel, zraněných jsou desítky;Austin (USA) - Částmi amerických států Texas, Arkansas a Oklahoma se v pátek prohnala silná bouře s tornády. Živel srovnal se zemí desítky budov, nejméně jeden člověk zemřel a dvě...
Američané volí nový Kongres, podle průzkumů se bude dařit republikánům;Washington - Spojené státy 8. listopadu čekají volby, jež se konají v polovině čtyřletého funkčního období prezidenta. Hlasovat se bude o složení celé Sněmovny reprezentantů a třetiny...
Stoltenberg jednal s Erdoganem o rozšíření NATO a obilném koridoru;Ankara - Ruská agrese vůči Ukrajině a ratifikace vstupu Švédska a Finska do Severoatlantické aliance byly hlavními tématy, o nichž dnes hovořil v Istanbulu generální tajemník NATO Jens...
Írán podle zdrojů CNN žádá Rusko o pomoc s jaderným programem;Washington/Teherán - Írán žádá Rusko o pomoc se svým jaderným programem a chce po něm dodávky radioaktivního materiálu a technologií na výrobu jaderného paliva. Informovala o tom dnes...
USA budou podporovat Ukrajinu i po volbách, řekl v Kyjevě Bidenův poradce;Kyjev - Spojené státy budou dál "neochějně podporovat" Ukrajinu i po nadcházejících volbách do Kongresu. V Kyjevě to dnes řekl bezpečnostní poradce amerického prezidenta Joea...
Použití chemických zbraní na Ukrajině bude mít pro Rusko následky, varuje G7;Münster (Německo) - Použití chemických, biologických nebo jaderných zbraní na Ukrajině bude mít pro Rusko vážné důsledky, varovali dnes ministři zahraničí skupiny vyspělých ekonomik...
Podle Putina je nutná evakuace obyvatel Chersonu;Moskva - Ruský prezident Vladimir Putin dnes podle deníku Kommersant prohlásil, že z ukrajinského Chersonu je potřeba evakuovat všechny civilisty, kteří žijí v zónách "nejnebezpečnějších...
USA a Nizozemsko zaplatí renovaci 90 českých tanků T-72 pro Ukrajinu;Washington/Amsterodam/Praha - Spojené státy a Nizozemsko společně zaplatí renovaci 90 českých tanků T-72B pro ukrajinskou armádu. Dnes to oznámila tisková mluvčí Pentagonu Sabrina Singhová....
Generální tajemník OSN vyzval KLDR k obnovení rozhovorů o jaderném odzbrojení;New York - Generální tajemník OSN António Guterres dnes odsoudil Severní Koreu za nedávné odpálení balistických raket, uvedla agentura Reuters s odvoláním na jeho mluvčího. Guterres také...
Papež kritizoval obnovu zastaralého konceptu dělení světa na nepřátelské tábory;Manáma - Papež František dnes kritizoval politiku rozdělování světa na Východ a Západ a obnovu už překonaných politických konceptů. Na mezinárodní konferenci v Bahrajnu vyzval k jednotě...
Putin: Střet s ukrajinským "neonacistickým režimem" byl nevyhnutelný;Moskva - Střet Ruska s ukrajinským "neonacistickým režimem" byl nevyhnutelný, řekl v projevu ke Dni národní jednoty ruský prezident Vladimir Putin. Boje na Ukrajině se podle něj...
Čínský prezident řekl Scholzovi, že je třeba odmítnout hrozby jadernými zbraněmi;Peking - Čínský prezident Si Ťin-pching na jednání s německým kancléřem Olafem Scholzem řekl, že je třeba, aby svět zamítl hrozby jadernými zbraněmi nebo jejich použití. Podle agentury...
Ukrajinská armáda hlásí těžké boje v Donbasu;Kyjev - Ukrajinská armáda hlásí těžké boje v Donbasu, cílem ruských útoků jsou především města Bachmut, Soledar a Avdijivka. Informovala o tom agentura DPA s odvoláním na armádního...
Rusko umožní mobilizaci lidí, kteří spáchali závažné trestné činy;Moskva - Ruský prezident Vladimir Putin dnes podepsal výnos, na jehož základě bude možné mobilizovat také osoby, které spáchaly některé závažné trestné činy. Celkem bylo podle Putina...
Kvůli přetížení sítě po ruských útocích nemá v Kyjevě proud 450.000 domácností;Kyjev - V Kyjevě je dnes bez proudu 450.000 domácností, sdělil na sociálních sítích starosta města Vitalij Kličko. Je to podle něj důsledek stabilizačních odstávek, které si vynucuje...
Předvolební kampaň v USA vrcholí, Trump naznačuje prezidentskou kandidaturu;Washington - Ve Spojených státech vrcholí kampaň před nadcházejícími volbami do amerického Kongresu, v nichž voliči rozhodnou o novém složení celé Sněmovny reprezentantů a třetiny...
V ruské armádě se podle Londýna rozmáhá vyhrožování dezertérům zastřelením;Kyjev - Ruská armáda pravděpodobně začala na Ukrajině nasazovat takzvané blokační nebo protiústupové jednotky, jejichž úkolem je odrazovat ruské vojáky od útěku tak, že jim hrozí...
Soul vyslal stíhačky v reakci na desítky přeletů vojenských letadel KLDR;Soul - Jižní Korea dnes vyslala do vzduchu desítky svých válečných letounů, včetně stíhaček F-35A, v reakci na 180 přeletů severokorejských vojenských letadel nedaleko společné hranice....
Rusko vede svatou válku proti Satanovi, uvedl Medveděv;Moskva - Místopředseda ruské bezpečnostní rady a bývalý prezident Dmitrij Medveděv v souvislosti s invazí na Ukrajinu uvedl, že Rusko válčí proti "umírajícímu světu" s jeho...
Ukrajinka se provdá za vojáka, aby v případě jeho smrti pomohla jeho partnerovi;Kyjev - Třiatřicetiletá Leda Kosmačevská z Kyjeva na sociálních sítích oznámila, že přijala nabídku k sňatku. Provdá se za kamaráda, který nyní slouží v ukrajinské armádě a který...
Ukrajinští vojáci musí odrážet až 80 ruských útoků za den, uvedl Zalužnyj;Kyjev - Ruská vojska na některých úsecích fronty ztrojnásobila intenzitu svých bojových akcí a podnikají až 80 útoků denně proti ukrajinským obráncům, uvedl náčelník ukrajinského...
Meloniová se sešla se špičkami EU, mluvilo se o energetice či podpoře Ukrajiny;Brusel - Nová italská premiérka Giorgia Meloniová se dnes v Bruselu setkala se špičkami institucí Evropské unie při sérii schůzek věnované energetické krizi, podpoře Ukrajiny či migraci....
Ruští vojáci se patrně stáhnou z Chersonu, uvedl zástupce okupační správy;Kyjev - Ruská vojska se patrně budou stahovat ze západního břehu Dněpru v Chersonské oblasti, řekl podle listu Kommersant zástupce ruských okupačních úřadů v regionu Kirill Stremousov....
V izraelských volbách zvítězil Netanjahu, Lapid mu pogratuloval;Jeruzalém - Bývalý izraelský premiér Benjamin Netanjahu spolu se svými spojenci v úterních parlamentních volbách získal jasnou většinu mandátů, informovala dnes volební komise. Podle...
